CourseID,CourseName,Unit,ReviewNumber,AvgStar,Level,Description
500,Introduction to Data Analytics for Business,University of Colorado Boulder,3107,4.7,Beginner level,"Describe the information lifecycle from events in the real world to business actions 
Recognize the types of events and characteristics that are often used in business analytics
Explain how the data is captured by source systems and stored using both traditional and emergent technologies
Gain familiarity with relational databases and learn how to use a simple but powerful language called SQL to extract analytical data sets of interest
"
489,Introduction to Big Data,University of California San Diego,10799,4.6,,
200,Data Analysis and Presentation Skills: the PwC Approach Final Project,PwC,246,4.7,Beginner level,
513,Introduction to Microsoft Azure Synapse Analytics,Microsoft,66,3.9,Intermediate level,"How to use Azure Synapse Analytics to build Data Warehouses using modern architecture patterns
How to describe the features and components of Azure Synapse Analytics 
How to use Azure Synapse Analytics to build your analytical solutions in one place 
How to use Azure Synapse Studio application to interact with the various components of Azure Synapse Analytics 
"
852,Using Advanced Formulas and Functions in Excel,Coursera Project Network,32,3.3,Intermediate level,"Create and apply several advanced excel functions to real world examples. 
Write and apply logic functions,  text functions and lookup and reference type queries. 
"
660,Power BI for Beginners Introduction to DAX Language,Coursera Project Network,19,4.5,Beginner level,"Create some DAX formulas to create calculated tables and columns  
 Create calculated measures using variables, date and aggregation functions  
 Create measures using filter functions and iterators 
"
733,Reinforcement Learning in Finance,New York University,126,3.5,Advanced level,
287,Data Warehousing for Business Intelligence Specialization,University of Colorado System,2383,4.5,Advanced level,
585,Machine Learning: Classification,University of Washington,3710,4.7,,
115,Build a Machine Learning Web App with Streamlit and Python,Coursera Project Network,385,4.7,Intermediate level,"Build interactive web applications with Streamlit and Python
Train Logistic Regression, Random Forest, and Support Vector Classifiers using scikit-learn
Plot evaluation metrics for binary classification algorithms
"
761,Sentiment Analysis with Deep Learning using BERT,Coursera Project Network,390,4.5,Intermediate level,"Preprocess and clean data for BERT Classification
Load in pretrained BERT with custom output layer
Train and evaluate finetuned BERT architecture on your own problem statement
"
559,MLOps Platforms: Amazon SageMaker and Azure ML,Duke University,27,3.8,Advanced level,"Apply exploratory data analysis (EDA) techniques to data science problems and datasets.
Build machine learning modeling solutions using both AWS and Azure technology.
Train and deploy machine learning solutions to a production environment using cloud technology.
"
521,Introduction to Python Fundamentals,University of Colorado Boulder,103,4.7,Beginner level,"By successfully completing this course, you will be able to describe the fundamentals of programming in Python.
You will be able to identify basic variables and data types.
You will also be able to write simple programs with Python.
"
665,Practicing for the SAS Programming Certification Exam,SAS,90,4.8,Intermediate level,
14,AI Workflow: Feature Engineering and Bias Detection,IBM,68,4.4,Advanced level,
216,Data Analysis with Spreadsheets and SQL,Meta,19,4.3,Beginner level,
735,Reproducible Research,Johns Hopkins University,4154,4.6,,"Organize data analysis to help make it more reproducible
Write up a reproducible data analysis using knitr
Determine the reproducibility of analysis project
Publish reproducible web documents using Markdown
"
252,Data Science Specialization,Johns Hopkins University,38649,4.5,Beginner level,"Use R to clean, analyze, and visualize data.
Navigate the entire data science pipeline from data acquisition to publication. 
Use GitHub to manage data science projects.
Perform regression analysis, least squares and inference using regression models.
"
437,Google Business Intelligence Professional Certificate,Google,1214,4.7,Advanced level,"Explore the roles of business intelligence (BI) professionals within an organization
Practice data modeling and extract, transform, load (ETL) processes that meet organizational goals 
Design data visualizations that answer business questions
Create dashboards that effectively communicate data insights to stakeholders
"
327,Detecting COVID-19 with Chest X-Ray using PyTorch,Coursera Project Network,329,4.5,Intermediate level,"Create custom Dataset and DataLoader in PyTorch
Train a ResNet-18 model in PyTorch to perform Image Classification
"
432,Getting started with TensorFlow 2,Imperial College London,550,4.9,Intermediate level,
388,Fundamentals of Data Analytics in the Public Sector with R,University of Michigan,25,4.7,Intermediate level,"Understand key terms and concepts in public administration, public policy
Learn foundational techniques using the R programming language
Create custom functions to analyze population data commonly found in public sector analytics
"
741,SARS-CoV-2 Protein Modeling and Drug Docking,Coursera Project Network,100,4.7,Intermediate level,"Learn homology modeling and drug docking
Model protein structures from sequence data
Perform molecular docking of drugs against protein molecules
"
522,Introduction to R Programming and Tidyverse,University of Colorado Boulder,32,4.3,Beginner level,"By successfully completing this course, you will be able to write functions in R.
You will be able to analyze and visualize a data set.
You will be able to use RMarkdown to share documents in reports with the global R community.
"
184,Creating Dashboards and Storytelling with Tableau,"University of California, Davis",1001,4.6,Beginner level," Combine the data and follow the best practices to present your story  
 Create calculated fields for KPIs to build a figure that will be used to measure progress in the data  
Assemble a dashboard  
 Analyze concepts and techniques for compelling storytelling with data  
"
373,Feature Engineering,Google Cloud,1750,4.5,Intermediate level,"Describe Vertex AI Feature Store and compare the key required aspects of a good feature.
Perform feature engineering using BigQuery ML, Keras, and TensorFlow.
Discuss how to preprocess and explore features with Dataflow and Dataprep.
Use tf.Transform.
"
687,Preparing for the SAS Programming Certification Exam,SAS,130,4.8,Intermediate level,
84,"Basic Data Descriptors, Statistical Distributions, and Application to Business Decisions",Rice University,2477,4.7,,
405,Generative AI for Data Scientists Specialization,IBM,69,4.8,Intermediate level,"Apply skills to recognize real-world generative AI uses and identify popular generative AI models and tools for text, code, image, audio, and video
Understand generative AI prompt engineering concepts, examples, and common tools and learn techniques to create effective, impactful prompts
Learn how to identify appropriate generative AI tools for data science use cases
Apply generative AI prompt techniques to generate and augment datasets and to develop and refine machine learning models
"
570,Machine Learning Operations (MLOps): Getting Started,Google Cloud,416,4.0,Intermediate level,"Identify and use core technologies required to support effective MLOps.
Adopt the best CI/CD practices in the context of ML systems.
Configure and provision Google Cloud architectures for reliable and effective MLOps environments.
Implement reliable and repeatable training and inference workflows.
"
670,Predict Sales and Forecast Trends in Google Sheets,Coursera Project Network,33,4.4,Beginner level,"  Understand how forecasting supports decision-making and identify use cases for forecasting trends.
Visualize and statistically examine the data by testing the slope of the regression line and creating a line chart.
Conduct linear regression and compare trend forecasting to other techniques.
"
483,Intro to AI Engineering,Scrimba,0,0.0,Intermediate level,"AI Fundamentals
Ethical AI
Prompt engineering
AI Intergrations
"
401,Generalized Linear Models and Nonparametric Regression,University of Colorado Boulder,14,4.4,Intermediate level,"Describe how to generalize the linear model framework to accommodate data that is not suitable for the standard linear regression model.
State some advantages and disadvantages of (generalized) additive models.
Describe how an additive model can be generalized to incorporate non-normal response variables (i.e., define a generalized additive model).
"
823,The Pytorch basics you need to start your ML projects,Coursera Project Network,41,3.6,Intermediate level,"You will learn how to prepare your ML coding environment.
You will know how to initialize and use Pytorch tensors.
You will know how to use the PyTorch neural network module
"
464,Image Compression and Generation using Variational Autoencoders in Python,Coursera Project Network,76,4.7,Intermediate level,"How to preprocess and prepare data for vision tasks using PyTorch
What a variational autoencoder is and how to train one
How to compress, reconstruct, and generate new images using a generative model
"
728,Regression Models,Johns Hopkins University,3341,4.4,,"Use regression analysis, least squares and inference
Understand ANOVA and ANCOVA model cases
Investigate analysis of residuals and variability
Describe novel uses of regression models such as scatterplot smoothing
"
433,Github CoPilot for Beginners: Write Software With AI,Coursera Project Network,31,4.6,Intermediate level,"Harness GitHub Copilot's AI-driven suggestions to accelerate the web development process
Design and implement responsive web components by effectively guiding Copilot with expertly crafted prompts
Refine and adapt AI-generated code to ensure the website aligns with desired specifications, aesthetics, and functionality
"
425,Getting Started with Data Visualization in R,Johns Hopkins University,246,4.7,Beginner level,
338,Emotion AI: Facial Key-points Detection,Coursera Project Network,157,4.6,Intermediate level,"Understand the theory and intuition behind Deep Neural Networks, and Residual Neural Networks, and Convolutional Neural Networks (CNNs).
Build and train a deep learning model based on Convolutional Neural Network and Residual blocks using Keras with Tensorflow 2.0 as a backend.
Assess the performance of trained CNN and ensure its generalization using various Key performance indicators.
"
859,Using TensorFlow with Amazon Sagemaker,Coursera Project Network,97,4.6,Advanced level,"Prepare custom script for Sagemaker.
Train a TensorFlow model using Sagemaker.
Deploy a TensorFlow trained model using Sagemaker.
"
330,Developing Data Models with LookML,Google Cloud,48,4.8,Intermediate level,"Define LookML basic terms and building blocks
Model new dimensions and measures using LookML and use dashboards to combine key queries and visualizations into a one page executive view
Model files of LookML projects to design and build custom Explores for business users
Use derived tables in Looker to create new custom tables and use datagroups to manage caching policies
"
307,Deep Learning for Real Estate Price Prediction,Coursera Project Network,18,4.4,Beginner level,"Understand the theory and intuition behind Deep Learning 
Train Artificial Neural Networks to perform real estate price prediction 
Perform Data Visualization, Data Cleaning, Feature Engineering and Exploratory Data Analysis
"
193,Customer Service with Python: Build a Chatbot using ChatGPT,Coursera Project Network,0,0.0,Intermediate level,"Use Python to integrate the ChatGPT API for chatbot functionality
Design a conversation flow to handle FAQs in customer service scenarios
Build and test a Customer Service chatbot
"
427,Getting Started with Rstudio,Coursera Project Network,131,4.6,Beginner level,"Install R and RStudio on your desktop, or use the new cloud-based solution that allows anyone to learn R, directly from your browser.
Know the 10 most important things that 99% of R programmers should know about the RStudio IDE Interface.
Be able to explain what R packages are, how to install and load them, from CRAN and Github, into the R session, and create interactive HTML widgets.
"
180,Create Interactive Dashboards with Streamlit and Python,Coursera Project Network,384,4.7,Intermediate level,"Build interactive data dashboards with Streamlit and Python
Use Pandas for data manipulation in data science workflows
Create interactive plots with Plotly Python
"
712,Python for Beginners: Variables and Strings,Coursera Project Network,17,4.6,Beginner level," Discover and experiment with python strings basic operation
 Use python built-in string methods
 Apply string methods in real-world scenarios; Shopping List Cost Analysis  
"
275,Data Visualization in Tableau: Create Dashboards and Stories,Coursera Project Network,19,4.5,Intermediate level," Develop a best practice interactive dashboard for data exploration, including using dashboard actions for interactivity
 Develop a best practice interactive dashboard for reporting, including using filters for interactivity
 Develop a best practice data story to put across an argument, justified by data
"
278,Data Visualization with ChatGPT: Python for Dashboarding,Coursera Project Network,0,0.0,Intermediate level,"Write, debug Python code using ChatGPT.
Generate visualizations in Python using ChatGPT.  
Integrate ChatGPT-generated code into Streamlit apps. 
"
219,Data Cleaning in Excel: Techniques to Clean Messy Data,Coursera Project Network,19,4.4,Intermediate level," create a clean data set from an untidy set of student data, ready to be used for reporting .
"
157,Climate Geospatial Analysis on Python with Xarray,Coursera Project Network,37,4.4,Intermediate level,"Loading, exporting and interacting with climate NetCDF datasets
Apply simple and grouped operations over multidimensional data
Navigate and visualize multidimensional geospatial data
"
550,Linear Regression for Business Statistics,Rice University,1335,4.8,,
106,Breast Cancer Prediction Using Machine Learning,Coursera Project Network,31,4.5,Intermediate level,"Learn to Build Logistic Regression Classifier to Classify Cancer as Malignant or Benign
Learn to download dataset directly from Kaggle using Kaggle API
Learn to work with Google Colab in Cloud
"
783,Statistical Analysis Fundamentals using Excel,IBM,0,0.0,Intermediate level,"Describe the fundamental concepts of statistics and apply them to business and data analytics settings. 
Apply data collection, analysis, and interpretation techniques to derive actionable insights for making informed business decisions.
Apply descriptive and inferential analysis methods to derive insights and actionable recommendations from data.
Apply hypothesis testing, regression analysis, and forecasting to support business decision-making processes.
"
586,Machine Learning: Clustering & Retrieval,University of Washington,2344,4.7,,
560,MLOps Tools: MLflow and Hugging Face,Duke University,19,3.6,Advanced level,"Create new MLflow projects to create and register models.
Use Hugging Face models and datasets to build your own APIs.
Package and deploy Hugging Face to the Cloud using automation.
"
146,CertNexus Certified Data Science Practitioner Professional Certificate,CertNexus,38,4.7,Intermediate level,
825,The Role of the CEO in Navigating GenAI,Coursera,16,5.0,Beginner level,"Why GenAI is critically important for CEOs to understand
How to start your AI journey
What AI is and what it can do
How to go hands on with Generative AI to enhance your performance as a CEO
"
597,Mastering Data Analysis in Excel,Duke University,3909,4.2,,
170,Computational Social Science Methods,"University of California, Davis",323,4.7,Beginner level,"Examine the history and current challenges faced by Social Science through the digital revolution.
Configure a machine to create a database that can be used for analysis.
Discuss what is artificial intelligence (AI) and train a machine.
Discover how social networks and human dynamics create social systems and recognizable patterns.
"
11,AI Workflow: Business Priorities and Data Ingestion,IBM,151,4.3,Intermediate level,
545,"Linear Algebra: Matrix Algebra, Determinants, & Eigenvectors",Johns Hopkins University,19,4.8,,
99,Big Data Integration and Processing,University of California San Diego,2395,4.4,Beginner level,
51,Advanced SAS Programming Techniques,SAS,84,4.8,Intermediate level,
241,Data Processing and Feature Engineering with MATLAB,MathWorks,331,4.7,Intermediate level,"Prepare data for further analysis by removing noise, identifying outliers, & merging data from multiple sources
Create and evaluate features for machine learning applications
Explore special techniques for handling textual, audio, & image data
Perform unsupervised machine learning
"
246,Data Science Fundamentals Specialization,"University of California, Irvine",133,4.3,Beginner level,
767,Setting a Generative AI Strategy,Coursera,0,0.0,Beginner level,"How GenAI is poised to impact the business world
How to develop a GenAI strategy
How businesses are developing and deploying their GenAI
"
817,Text Retrieval and Search Engines,University of Illinois at Urbana-Champaign,942,4.5,,
507,Introduction to Deep Learning for Computer Vision,MathWorks,0,0.0,Intermediate level,"Develop a strong foundation in deep learning for image analysis
Retrain common models like GoogLeNet and ResNet for specific applications
Investigate model behavior to identify errors, determine potential fixes, and improve model performance 
Complete a real-world project to practice the entire deep learning workflow
"
632,Natural Language Processing on Google Cloud,Google Cloud,516,4.4,Advanced level,
288,Data Warehousing with Microsoft Azure Synapse Analytics,Microsoft,44,4.0,Intermediate level,"How to use Azure Synapse Analytics to build Data Warehouses using modern architecture patterns
How to design a Modern Data Warehouse using Azure Synapse Analytics  
How to manage, optimize, and secure a data warehouse  
How to design a multidimensional schema to optimize analytical workloads  
"
285,Data Visualization with Tableau Project,"University of California, Davis",537,4.6,Intermediate level,"Develop a project proposal
 Assess the quality of the data and perform exploratory analysis
 Create KPIs and dashboards and assess your analysis
 Create your data story and write a narrative to accompany your visualization
"
286,Data Visualization with Tableau Specialization,"University of California, Davis",7072,4.5,Beginner level,"Examine, navigate, and learn to use the various features of Tableau
 Assess the quality of the data and perform exploratory analysis
Create and design visualizations and dashboards for your intended audience
 Combine the data to and follow the best practices to present your story
"
28,ASQ-Certified Six Sigma Yellow Belt Exam Prep Specialization Specialization,SkillUp EdTech,0,0.0,Beginner level,"Describe the fundamentals of Lean Six Sigma methodology and its application.
Explain the DMAIC framework and its role in process improvement.
 Implement the relevant tool to conduct root cause analysis for identifying the underlying causes in your process.
"
485,Intro to Time Series Analysis in R,Coursera Project Network,243,4.4,Beginner level,"Fit various types of time series models to real world data and use them to forecast the future.
Understand how to assess model fit in time series data.
Know the reasons why time series models and methodology are an important toolkit for any data scientist.
"
577,Machine Learning for Telecom Customers Churn Prediction,Coursera Project Network,33,4.7,Beginner level,"Understand the theory and intuition behind machine learning classifiers such as Logistic Regression, Support Vector Machines, and Random Forest. 
Compare trained models by calculating AUC score and plot ROC curve
Train various classifier models using Scikit-Learn library
"
458,IBM Data Analytics with Excel and R Professional Certificate,IBM,1983,4.7,Beginner level,"Master the most up-to-date practical skills and knowledge data analysts use in their daily roles
Learn how to perform data analysis, including data preparation, statistical analysis, and predictive modeling using R, R Studio, and Jupyter
Utilize Excel spreadsheets to perform a variety of data analysis tasks like data wrangling, using pivot tables, data mining, & creating charts
Communicate your data findings using various data visualization techniques including, charts, plots & interactive dashboards with Cognos and R Shiny
"
873,XG-Boost 101: Used Cars Price Prediction,Coursera Project Network,44,4.7,Intermediate level,"Understand the theory and intuition behind XG-Boost Algorithm.
Build, train and evaluate XG-Boost, Random Forest, Decision Tree, and Multiple Linear Regression Models Using Scikit-Learn.
Assess the performance of trained regression models using various Key performance indicators.
"
685,Preparing for AI-900: Microsoft Azure AI Fundamentals exam,Microsoft,72,4.7,Beginner level,"How to refresh and test your knowledge of the skills mapped to all the main topics covered in the AI-900 exam
How to demonstrate proficiency in the skills measured in Exam AI-900: Microsoft Azure AI Fundamentals
How to outline the key points covered in the Microsoft Azure AI Fundamentals Specialization 
How to describe best practices for preparing for the Exam AI-900: Microsoft Azure AI Fundamentals
"
583,Machine Learning with PySpark: Customer Churn Analysis,Coursera Project Network,0,0.0,Intermediate level," Use AI driven solution to solve a business problem  
 Build a machine learning model with PySpark  
 Apply data cleansing activities using PySpark  
"
27,ASQ-Certified Six Sigma Black Belt (CSSBB) Exam Prep Specialization,SkillUp EdTech,0,0.0,Intermediate level,"Explain the core principles of the Six Sigma methodology, including the systems and tools used.
Apply advanced statistical tools and techniques in each DMAIC phase for process improvement.
Manage team dynamics and assign roles and responsibilities effectively.
Demonstrate leadership skills in project management and problem-solving.
"
281,Data Visualization with Power BI: Storytelling with Data,Coursera Project Network,0,0.0,Intermediate level,"Prepare and explore the data for visualization in Power BI
Build a report using different visuals, graphs, and data storytelling concepts that provides insights and recommendations
"
738,"Reverse and complement nucleic acid sequences (DNA, RNA) using R",Coursera Project Network,51,4.4,Beginner level,"Understand the basic building blocks in the R language.
Develop an R program that constructs reverse, complement, and reverse-complement nucleic acid sequences (DNA, RNA).
Read a file that has a long DNA sequence and then apply the code to the data in the file.
"
358,Exploratory Data Analysis with MATLAB,MathWorks,795,4.8,Beginner level,"Import large tabular datasets & customize the import options for your application
Extract subsets of data & compute statistics on groups of related data
Create customized visualizations to highlight the most relevant results from your analysis
Use interactive tools to explore, analyze, & visual data with automated code generation for reproducing results
"
714,Python for Data Science,Fractal Analytics,31,3.9,Beginner level,"Explain the significance of Python in data science and its real-world applications.
Apply Python to manipulate and analyze diverse data sources, using Pandas and relevant data types
Create informative data visualizations and draw insights from data distributions and feature relationships
Develop a comprehensive data preparation workflow for machine learning, including data rescaling and feature engineering
"
579,Machine Learning in the Enterprise,Google Cloud,1447,4.6,Intermediate level,"Describe data management, governance, and preprocessing options
Identify when to use Vertex AutoML, BigQuery ML, and custom training
Implement Vertex Vizier Hyperparameter Tuning
Explain how to create batch and online predictions, setup model monitoring, and create pipelines using Vertex AI
"
704,Publishing Visualizations in R with Shiny and flexdashboard,Johns Hopkins University,63,4.9,,
340,Empowering and Transforming Your Organization with GenAI,Coursera,0,0.0,Beginner level,"How to prepare your workforce for Generative AI change
How to engage critical stakeholders about your GenAI strategy
The importance of upskilling your team to adopt GenAI
"
637,Navigating Generative AI Risks for Leaders,Coursera,0,0.0,Beginner level,"The meaning of Responsible AI
The risks and concerns associated with GenAI
Perspectives on how to navigate these risks
"
100,Big Data Modeling and Management Systems,University of California San Diego,2986,4.4,,
794,Storytelling With Data,Coursera Project Network,146,4.5,Beginner level," Learn how to use Suspense and Surprise in storytelling
Learn how to use action headings and  highlight data to put your point across
"
12,AI Workflow: Data Analysis and Hypothesis Testing,IBM,101,4.2,Advanced level,
833,Total Data Quality Specialization,University of Michigan,14,4.5,Beginner level,"Explore the Total Data Quality framework.
Learn how to integrate data quality assessments as a critical component in all your projects.
Understand on the initial steps of data science, emphasizing data collection, data source evaluation, and techniques for ensuring high-quality data. 
"
