CourseID,CourseName,Unit,ReviewNumber,AvgStar,Level,Description
781,Sports Performance Analytics Specialization,University of Michigan,202,4.5,Intermediate level,"Understand how to construct predictive models to anticipate team and player performance.
Understand the science behind athlete performance and game prediction.
Engage in a practical way to apply their Python, statistics, or predictive modeling skills.
"
568,Machine Learning Modeling Pipelines in Production,DeepLearning.AI,411,4.4,Advanced level,"Apply techniques to manage modeling resources and best serve batch and real-time inference requests.
Use analytics to address model fairness, explainability issues, and mitigate bottlenecks.
"
4,AI Applications in People Management,University of Pennsylvania,133,4.7,,
136,Business Statistics and Analysis Specialization,Rice University,7318,4.7,Beginner level,
631,Natural Language Processing in TensorFlow,DeepLearning.AI,6401,4.6,Intermediate level,"Build natural language processing systems using TensorFlow
Process text, including tokenization and representing sentences as vectors
Apply RNNs, GRUs, and LSTMs in TensorFlow
Train LSTMs on existing text to create original poetry and more
"
240,Data Modeling in Power BI,Microsoft,291,4.2,Beginner level,"How to form a model using a Star Schema.  
How to write calculations DAX to create elements and analysis in Power BI. 
How to optimize performance in a Power BI model.  
"
813,TensorFlow: Data and Deployment Specialization,DeepLearning.AI,1308,4.7,Intermediate level,"Run models in your browser using TensorFlow.js
Prepare and deploy models on mobile devices using TensorFlow Lite
Access, organize, and process training data more easily using TensorFlow Data Services
Explore four advanced deployment scenarios using TensorFlow Serving, TensorFlow Hub, and TensorBoard
"
394,Fundamentals of Reinforcement Learning,University of Alberta,2711,4.8,Intermediate level,"Formalize problems as Markov Decision Processes 
Understand basic exploration methods and the exploration / exploitation tradeoff
Understand value functions, as a general-purpose tool for optimal decision-making
Know how to implement dynamic programming as an efficient solution approach to an industrial control problem
"
321,Deploying Machine Learning Models in Production,DeepLearning.AI,322,4.5,Advanced level,
503,Introduction to Data Science in Python,University of Michigan,26908,4.5,Intermediate level,"Understand techniques such as lambdas and manipulating csv files
Describe common Python functionality and features used for data science
Query DataFrame structures for cleaning and processing
Explain distributions, sampling, and t-tests
"
616,Microsoft Azure Developer Associate (AZ-204) Professional Certificate,Microsoft,142,4.6,Intermediate level,
802,Supply Chain Management and Analytics,Unilever,25,4.8,Beginner level,
633,Natural Language Processing with Attention Models,DeepLearning.AI,972,4.4,Intermediate level,"Use encoder-decoder, causal, & self-attention to machine translate complete sentences, summarize text, build chatbots & question-answering.
"
18,AI and Public Health,DeepLearning.AI,151,4.7,Beginner level,
345,Evaluations of AI Applications in Healthcare,Stanford University,203,4.6,Beginner level,"Principles and practical considerations for integrating AI into clinical workflows
Best practices of AI applications to promote fair and equitable healthcare solutions
Challenges of regulation of AI applications and which components of a model can be regulated
What standard evaluation metrics do and do not provide
"
572,Machine Learning Specialization,University of Washington,12518,4.7,Intermediate level,
636,Natural Language Processing with Sequence Models,DeepLearning.AI,1097,4.5,Intermediate level,"Use recurrent neural networks, LSTMs, GRUs & Siamese networks in Trax for sentiment analysis, text generation & named entity recognition.
"
808,Survey Data Collection and Analytics Specialization,University of Michigan,846,4.3,Beginner level,"Understand the basics of survey design, sampling methods, data collection and data analysis
Apply the skills learned to analyze and compare multiple data sources in a capstone project
"
171,Computational Social Science Specialization,"University of California, Davis",544,4.7,Beginner level,"Discover how social networks and human dynamics create social systems and recognizable patterns
Define and discuss big data opportunities and limitations
Web scrape online data, create a social network visualization with it, and use machine learning to analyze its content  
Use computer simulations to program your own artificial societies to explore business strategies and policy options
"
231,Data Literacy: Exploring and Visualizing Data Specialization,SAS,5,5.0,Beginner level,
456,IBM Data Analyst Capstone Project,IBM,1050,4.6,Intermediate level,"Apply different techniques to collect and wrangle data
Showcase your Data Analysis and Visualization skills 
Create a data analysis report and a compelling presentation
Demonstrate proficiency with various Python Libraries
"
620,Microsoft PL-300 Exam Preparation and Practice,Microsoft,81,4.5,Beginner level,"How to prepare the data with Power BI.
How to Model the data in Power BI.
How to visualize and analyze the data with Power BI.
How to deploy and maintain Power BI assets.
"
518,Introduction to Probability and Data with R,Duke University,5569,4.7,Beginner level,
692,Probabilistic Graphical Models 1: Representation,Stanford University,1425,4.6,Advanced level,
120,Building Deep Learning Models with TensorFlow,IBM,798,4.4,Intermediate level,"Explain foundational TensorFlow concepts such as the main functions, operations and the execution pipelines. 
Describe how TensorFlow can be used in curve fitting, regression, classification and minimization of error functions.
Analyze different types of Deep Architectures, such as Convolutional Networks, Recurrent Networks and Autoencoders.
Apply TensorFlow for backpropagation to tune the weights and biases while the Neural Networks are being trained.
"
187,Creative Designing in Power BI,Microsoft,83,4.4,Beginner level,"How to create compelling and cohesive reports and dashboards. 
How to work in detail with specialist chart visualizations.
How to add elements such as videos, streaming data and QR codes to dashboards.
"
614,Microsoft Azure Data Fundamentals DP-900 Exam Prep Specialization,Microsoft,536,4.7,Beginner level,"The fundamentals of database concepts in a cloud environment, basic skilling in cloud data services, and cloud data services within Microsoft Azure.
"
37,Advanced Computer Vision with TensorFlow,DeepLearning.AI,464,4.8,Intermediate level,
440,Google Data Analytics Professional Certificate,Google,133572,4.8,Beginner level,"Gain an immersive understanding of the practices and processes used by a junior or associate data analyst in their day-to-day job
Learn key analytical skills (data cleaning, analysis, & visualization) and tools (spreadsheets, SQL, R programming, Tableau) 
Understand how to clean and organize data for analysis, and complete analysis and calculations using spreadsheets, SQL and R programming
Learn how to visualize and present data findings in dashboards, presentations and commonly used visualization platforms
"
65,Applied Data Science Capstone,IBM,6993,4.7,Intermediate level,"Demonstrate proficiency in data science and machine learning techniques using a real-world data set and prepare a report for stakeholders   
Apply your skills to perform data collection, data wrangling, exploratory data analysis, data visualization model development, and model evaluation
Write Python code to create machine learning models including support vector machines, decision tree classifiers, and k-nearest neighbors  
Evaluate the results of machine learning models for predictive analysis, compare their strengths and weaknesses and identify the optimal model   
"
108,Build Better Generative Adversarial Networks (GANs),DeepLearning.AI,636,4.7,Intermediate level,
189,"Custom Models, Layers, and Loss Functions with TensorFlow",DeepLearning.AI,981,4.9,Intermediate level,
16,AI and Climate Change,DeepLearning.AI,65,4.8,Beginner level,
509,Introduction to Genomic Technologies,Johns Hopkins University,4471,4.6,,
593,Managing Machine Learning Projects,Duke University,135,4.8,Beginner level,
438,Google Cloud Big Data and Machine Learning Fundamentals,Google Cloud,15932,4.7,Beginner level,"Identify the data-to-AI lifecycle on Google Cloud and the major products of big data and machine learning.
Design streaming pipelines with Dataflow and Pub/Sub and dDesign streaming pipelines with Dataflow and Pub/Sub.
Identify different options to build machine learning solutions on Google Cloud.
Describe a machine learning workflow and the key steps with Vertex AI and build a machine learning pipeline using AutoML.
"
320,Deploy and Maintain Power BI Assets and Capstone project,Microsoft,68,4.3,Beginner level,"How to create and publish an app in Power BI.
How to implement dynamic reports in Power BI. 
How to implement security measures and alerting in a Power BI report or dashboard.
"
80,Assessment for Data Analysis and Visualization Foundations,IBM,197,4.6,Beginner level,"Demonstrate readiness for performing foundational data analysis and data visualization tasks and key steps in the Data Analytics process.
Differentiate between the roles different data professionals play in a modern data ecosystem.
Perform basic Excel tasks for Data Analysis including data quality and data preparation skills.
Exhibit abilities in visualizing data using Excel and proficiency in creating dashboards using Excel and Cognos Analytics.
"
799,Supervised Machine Learning: Regression,IBM,518,4.7,Intermediate level,
540,Learn SQL Basics for Data Science Specialization,"University of California, Davis",9914,4.5,Beginner level,"Use SQL commands to filter, sort, & summarize data; manipulate strings, dates, & numerical data from different sources for analysis
Assess and create datasets to solve your business questions and problems using SQL
Use the collaborative Databricks workspace and create an end-to-end pipeline that reads data, transforms it, and saves the result
Develop a project proposal & select your data, perform statistical analysis & develop metrics, and present your findings & make recommendations
"
532,"Introduction to Trading, Machine Learning & GCP",Google Cloud,812,4.0,Intermediate level,"Understand the fundamentals of trading, including the concepts of trend, returns, stop-loss, and volatility.
Define quantitative trading and the main types of quantitative trading strategies.
Understand the basic steps in exchange arbitrage, statistical arbitrage, and index arbitrage.
Understand the application of machine learning to financial use cases.
"
428,Getting Started with SAS Programming,SAS,2980,4.8,Beginner level,
697,Problem Solving with Excel,PwC,5264,4.7,Beginner level,
742,SAS Advanced Programmer Professional Certificate,SAS,304,4.8,Intermediate level,"Process data using Structured Query Language in the SAS environment    
Use the SAS macro facility to design, write, and debug dynamic macro programs  
Use advanced DATA step techniques and procedures to manipulate data    
"
325,Design of Experiments Specialization,Arizona State University,274,4.7,Beginner level,"Plan, design and conduct experiments efficiently and effectively, and analyze the resulting data to obtain valid objective conclusions.
Use response surface methods for system optimization as a follow-up to successful screening.
Use experimental design tools for computer experiments, both deterministic and stochastic computer models.
Use software tools to create custom designs based on optimal design methodology for situations where standard designs are not easily applicable.
"
756,Sample-based Learning Methods,University of Alberta,1216,4.8,Intermediate level,
21,AI for Medical Prognosis,DeepLearning.AI,757,4.7,Intermediate level,"Walk through examples of prognostic tasks
Apply tree-based models to estimate patient survival rates
Navigate practical challenges in medicine like missing data  
"
74,Apply Generative Adversarial Networks (GANs),DeepLearning.AI,507,4.8,Intermediate level,
832,Tools for Data Science,IBM,28241,4.5,Beginner level,"Describe the Data Scientist’s tool kit which includes: Libraries & Packages, Data sets, Machine learning models, and Big Data tools   
Utilize languages commonly used by data scientists like Python, R, and SQL   
Demonstrate working knowledge of tools such as Jupyter notebooks and RStudio and utilize their various features    
Create and manage source code for data science using Git repositories and GitHub.   
"
826,The Structured Query Language (SQL),University of Colorado Boulder,605,4.7,Beginner level,"The origins and historical basis for SQL
Standard SQL  use and syntax
How to code SQL queries in order to analyze data stored in relational databases 
"
143,"Capstone: Retrieving, Processing, and Visualizing Data with Python",University of Michigan,13685,4.7,Beginner level,"Make use of unicode characters and strings
Understand the basics of building a search engine
Select and process the data of your choice
Create email data visualizations
"
491,Introduction to Business Analytics,Tableau Learning Partner,161,4.7,Beginner level,"Demonstrate a foundational knowledge of the business analyst role.
Explain the foundational project management topics and skills used by a BI analyst.
Describe data literacy and its importance for a BI analyst.
"
94,Bayesian Statistics: From Concept to Data Analysis,"University of California, Santa Cruz",3127,4.6,Intermediate level,"Describe & apply the Bayesian approach to statistics.
Explain the key differences between Bayesian and Frequentist approaches.
Master the basics of the R computing environment.
"
5,AI Capstone Project with Deep Learning,IBM,515,4.5,Advanced level,"Build a deep learning model to solve a real problem.
Execute the process of creating a deep learning pipeline.
Apply knowledge of deep learning to improve models using real data.
Demonstrate ability to present and communicate outcomes of deep learning projects.
"
396,Fundamentals of Visualization with Tableau,"University of California, Davis",6508,4.5,Beginner level," Install Tableau Public Software and create a visualization
 Examine and navigate the Tableau Public workspace
 Practice and connect to different data sources
 Examine ways to define your project
"
89,Basic Statistics,University of Amsterdam,4369,4.6,Beginner level,
739,Rust Fundamentals,Duke University,48,4.3,Beginner level,"Apply Rust's core concepts like ownership, borrowing, and lifetimes to write efficient, reliable, and safe code. 
Use Rust's advanced features like enums, structs, traits, and generics to build robust applications. 
Develop, document, test and debug Rust projects using Cargo, Rust Analyzer, and other tools in the Rust ecosystem. 
"
6,AI For Medical Treatment,DeepLearning.AI,505,4.7,Intermediate level,"Estimate treatment effects using data from randomized control trials
Explore methods to interpret diagnostic and prognostic models
Apply natural language processing to extract information from unstructured medical data
"
256,Data Science at Scale Specialization,University of Washington,538,4.1,Intermediate level,
576,Machine Learning for Supply Chains Specialization,LearnQuest,47,3.7,Intermediate level,
798,Supervised Machine Learning: Classification,IBM,311,4.8,Intermediate level,
54,Analytics for Decision Making Specialization,University of Minnesota,125,4.8,Beginner level,
451,Human Factors in AI,Duke University,70,4.7,Beginner level,"Identify and mitigate privacy and ethical risks in AI projects
Apply human-centered design practices to design successful AI product experiences
Build AI systems that augment human intelligence and inspire model trust in users
"
530,Introduction to Tableau,Tableau Learning Partner,98,4.8,Beginner level,"Describe the value of data visualizations in the field of business analytics.
How to preprocess data using Tableau Public
How to combine data from multiple tables found within the same data source as well as other data sources in Tableau Public.
"
426,Getting Started with R,Coursera Project Network,342,4.3,Beginner level,"Understand the basics of the R language
Work with the R data types and structures
"
724,Recommender Systems Specialization,University of Minnesota,697,4.4,Intermediate level,"Build recommendation systems
Implement collaborative filtering
Master spreadsheet based tools
Use project-association recommenders
"
192,Custom and Distributed Training with TensorFlow,DeepLearning.AI,384,4.8,Intermediate level,
291,"Data Wrangling, Analysis and AB Testing with SQL","University of California, Davis",927,3.3,Intermediate level,"Validate and clean a dataset
Assess and create datasets to answer your questions
Solve problems using SQL
Build a simple testing framework to touch on AB Testing
"
619,Microsoft Azure for Data Engineering,Microsoft,549,4.5,Intermediate level,"You will learn the various data platform technologies available, and how to take advantage of this technology to an organizations benefit.
Choose Microsoft Azure data technologies that meet different business needs and scale to meet demands securely
Describe common data engineering practices 
Explain the differences between on-premises and cloud data solutions 
"
607,Mathematics for Machine Learning: PCA,Imperial College London,3050,4.0,Intermediate level,"Implement mathematical concepts using real-world data
Derive PCA from a projection perspective
Understand how orthogonal projections work
Master PCA
"
23,AI for Scientific Research Specialization,LearnQuest,48,3.2,Beginner level,"How to use AI in scientific situations to discover trends and patterns within datasets
The complete machine learning process
Use artificial intelligence to predict sequences in datasets
"
212,Data Analysis with R,IBM,266,4.7,Intermediate level,"Prepare data for analysis by handling missing values, formatting and normalizing data, binning, and turning categorical values into numeric values.
Compare and contrast predictive models using simple linear, multiple linear, and polynomial regression methods.
Examine data using descriptive statistics, data grouping, analysis of variance (ANOVA), and correlation statistics.
Evaluate a model for overfitting and underfitting conditions and tune its performance using regularization and grid search.
"
581,Machine Learning with Apache Spark,IBM,55,4.6,Intermediate level,"Describe ML, explain its role in data engineering, summarize generative AI, discuss Spark's uses, and analyze ML pipelines and model persistence. 
Evaluate ML models, distinguish between regression, classification, and clustering models, and compare data engineering pipelines with ML pipelines. 
Construct the data analysis processes using Spark SQL, and perform regression, classification, and clustering using SparkML. 
Demonstrate connecting to Spark clusters, build ML pipelines, perform feature extraction and transformation, and model persistence. 
"
17,AI and Disaster Management,DeepLearning.AI,43,4.8,Beginner level,
32,Accounting Data Analytics Specialization,University of Illinois at Urbana-Champaign,164,4.6,Intermediate level,
855,Using Data Analytics in Supply Chain,Unilever,0,0.0,Beginner level,
61,Analyzing and Visualizing Data in Looker,Google Cloud,318,4.7,Beginner level,"Use dimensions, measures, filters, and pivots to analyze and visualize data
Create advanced metrics instantaneously with table calculations
Create visualizations using Looks and dashboards
Share Looker content with others
"
52,Algorithms for DNA Sequencing,Johns Hopkins University,877,4.7,,
47,Advanced Machine Learning and Signal Processing,IBM,1227,4.5,Advanced level,
145,CertNexus Certified Artificial Intelligence Practitioner Professional Certificate,CertNexus,47,4.3,Intermediate level,"Learn about the business problems that AI/ML can solve as well as the specific AI/ML technologies that can solve them.  
Learn important tasks that make up the workflow, including data analysis and model training and about how machine learning tasks can be automated. 
Use ML algorithms to solve the two most common supervised problems regression and classification, and a common unsupervised problem: clustering.
Explore advanced algorithms used in both machine learning and deep learning. Build multiple models to solve business problems within a workflow.
"
473,Informed Clinical Decision Making using Deep Learning Specialization,University of Glasgow,18,4.7,Intermediate level,"Extract and preprocess data from complex clinical databases
Apply deep learning in Electronic Health Records
Imputation of Electronic Health Records and data encodings
Explainable, fair and privacy-preserved Clinical Decision Support Systems
"
235,Data Mining Foundations and Practice Specialization,University of Colorado Boulder,28,3.8,Intermediate level,"Data mining pipeline: data understanding, preprocessing, warehousing
Data mining methods: frequent patterns, classification, clustering, outliers 
Data mining project: project formulation, design, implementation, reporting 
"
62,Apache Spark (TM) SQL for Data Analysts,Databricks,492,4.5,Intermediate level,"Ingest, transform, and query data to extract valuable insights.
Leverage existing SQL skills to start working with Apache Spark. 
"
508,Introduction to Designing Data Lakes on AWS,Amazon Web Services,220,4.7,Intermediate level,"Where to start with a Data Lake?
How to build a secure and scalable Data Lake?
What are the common components of a Data Lake?
Why do you need a Data Lake and what it's value?
"
64,Applied AI with DeepLearning,IBM,1109,4.4,Advanced level,
213,Data Analysis with R Programming,Google,9556,4.8,Beginner level,"Describe the R programming language and its programming environment.
Explain the fundamental concepts associated with programming in R including functions, variables, data types, pipes, and vectors.
Describe the options for generating visualizations in R.
Demonstrate an understanding of the basic formatting in R Markdown to create structure and emphasize content.
"
514,Introduction to Microsoft Excel,Coursera Project Network,24,4.6,Beginner level,"Entering simple data in Microsoft Excel.
Change the layout of data entered in Microsoft Excel.
"
127,Business Analysis Process,Tableau Learning Partner,58,4.7,Beginner level,"Demonstrate an in-depth knowledge of the business analysis process.
Create a business requirements document that conforms to industry best practices.
Create a visual model of a business process.
"
693,Probabilistic Graphical Models 2: Inference,Stanford University,482,4.6,Advanced level,
178,Copywriting with ChatGPT: Produce Compelling Copy That Sells,Coursera Project Network,15,4.8,Beginner level,"Master research techniques with ChatGPT to speed up audience insight gathering process and product USP generation
Develop compelling headlines and body copy using iterative refinement techniques
Optimize the AI-generated copy to ensure authenticity, making it resonate with human readers while effectively bypassing AI detection tools
"
154,Classification of COVID19 using Chest X-ray Images in Keras,Coursera Project Network,33,4.6,Intermediate level,"Learn to Build and Train the Convolutional Neural Network using Keras with Tensorflow as Backend
Learn to Visualize Data in Matplotlib
Learn to make use of the Trained Model to Predict on a New Set of Data
"
304,Deep Learning and Reinforcement Learning,IBM,180,4.6,Intermediate level,
239,Data Mining Specialization,University of Illinois at Urbana-Champaign,1961,4.5,Intermediate level,
674,Prediction and Control with Function Approximation,University of Alberta,808,4.8,Intermediate level,
548,Linear Regression and Modeling,Duke University,1686,4.8,Beginner level,
415,Generative Deep Learning with TensorFlow,DeepLearning.AI,251,4.9,Intermediate level,
472,Inferential Statistics,Duke University,2624,4.8,Beginner level,
603,Mastering Software Development in R Specialization,Johns Hopkins University,1258,4.2,Beginner level,"Build R packages
Custom data visualization and graphics
Data manipulation and wrangling
Produce and scale data science products
"
538,Launching into Machine Learning,Google Cloud,4273,4.6,Beginner level,"Describe how to improve data quality and perform exploratory data analysis
Build and train AutoML Models using Vertex AI and BigQuery ML
Optimize and evaluate models using loss functions and performance metrics
Create repeatable and scalable training, evaluation, and test datasets
"
346,Exam Prep DAS-C01: AWS Certified Data Analytics Specialty Specialization,Whizlabs,9,4.6,Beginner level,"Gain Skills to understand the fundamentals of  Data Analytics.
Learn working with various AWS Services necessary for Data Analytics 
"
498,Introduction to Data Analysis Using Excel,Rice University,10166,4.7,,
1,A Complete Reinforcement Learning System (Capstone),University of Alberta,620,4.7,Intermediate level,
780,Specialized Models: Time Series and Survival Analysis,IBM,123,4.5,Intermediate level,
134,Business Metrics for Data-Driven Companies,Duke University,8345,4.6,,
284,Data Visualization with Tableau,Tableau Learning Partner,47,4.8,Beginner level,"Identify the value and structure of Tableau Public as it applies to data visualization in the industry of business analytics.  
 Build interactive tables by connecting, preparing, and customizing data in Tableau Public.
 Create data visualizations to communicate analytic insights to the intended audience, such as business stakeholders.
"
849,Unsupervised Machine Learning,IBM,231,4.7,Intermediate level,
